{
  "schema_version": 1,
  "suite_id": "r08/mutation-qualification-v1",
  "status": "passed",
  "started_at": "2026-09-18T21:10:34Z",
  "finished_at": "2026-09-18T21:13:19Z",
  "schema_sha256": "ee5750d3ad7c04844dfaf9091104f3aba4444fb989c9e925b7f7cdd45c9ed26b",
  "rust": {
    "revision": "59cd77fbe451e27c30512fb7ff850dd503a87143",
    "tree": "76400fa49307f632fda07622423bb99c60fdab7f",
    "source_sha256": "992bb926301a02c7b47ee9fe6b1cbfb2e8c1e0aafcf556dc2f80997c811a457b",
    "compiler_image": "rust:1.98.0-bookworm@sha256:82150a52ec202c1b14d7817e14516c392bb7f5cfebd88f1ed531cb37ebd39922",
    "platform": "linux/arm64",
    "binary_sha256": "d7f42a3151882679d3cad724635a11f24ee46a391fe29f1634f44a6ef30960f8"
  },
  "go": {
    "revision": "c8bb148a1379b51ef87256c27f366a05f8da4dc4",
    "tree": "c5039b6b50a05b942a902f70dc2fcb090463e8c7",
    "compiler": "go1.26.8",
    "platform": "linux/arm64",
    "binary_sha256": "5b72f09cca58985435fa33a394c952766dbd90df88aaf5e8ffb79c3fd9110d0f"
  },
  "native": {
    "version": "librados2-20.2.4-0.el9",
    "binary_sha256": "18462ff2c5546d7b3dc85a3496f710f56babcaf64b9bef045771003e9745f01a"
  },
  "server": {
    "source_anchor_commit": "7f793731f1b39eb4f465e960113d2363c311b964",
    "version": "ceph version 20.2.4 (7f793731f1b39eb4f465e960113d2363c311b964) tentacle (stable)",
    "image": "quay.io/ceph/ceph@sha256:6e6bc7b28fa1b334108a3646af5533dfb50db508efdf5b358eb7dd0dd37a48aa",
    "binary_sha256": "5fbad656b7f1bd900a0c40990a81be8dff523555ed0b2c957e38f29beb33608a"
  },
  "scenarios": {
    "create": "passed",
    "write": "passed",
    "write_full": "passed",
    "append": "passed",
    "truncate": "passed",
    "zero": "passed",
    "remove": "passed",
    "cross_client_crud": "passed",
    "append_once_failover_lost_reply": "passed",
    "ack_vs_commit": "passed",
    "flush_watermark": "passed",
    "cancellation_drop_boundaries": "passed",
    "performance_baseline": "passed"
  },
  "performance": [
    {
      "implementation": "rust",
      "workload": "write-full-baseline-v1",
      "payload_bytes": 4096,
      "concurrency": 1,
      "operations": 128,
      "elapsed_seconds": 0.733096844,
      "operations_per_second": 174.60176107373886,
      "latency_p50_microseconds": 5248.285999999999,
      "latency_p95_microseconds": 10369.779,
      "latency_p99_microseconds": 13329.466,
      "cpu_user_seconds": 0.019999999999999997,
      "cpu_system_seconds": 0.01,
      "allocation_metric": {
        "name": "mutation_payload_owned_bytes",
        "value": 524288
      },
      "retained_bytes": 4096,
      "peak_rss_bytes": 5894144
    },
    {
      "implementation": "go",
      "workload": "write-full-baseline-v1",
      "payload_bytes": 4096,
      "concurrency": 1,
      "operations": 128,
      "elapsed_seconds": 0.992279366,
      "operations_per_second": 128.99593036584417,
      "latency_p50_microseconds": 6231.209,
      "latency_p95_microseconds": 14127.555,
      "latency_p99_microseconds": 24158.374,
      "cpu_user_seconds": 0.022113999999999998,
      "cpu_system_seconds": 0.011362999999999998,
      "allocation_metric": {
        "name": "runtime_total_alloc_bytes",
        "value": 5675456
      },
      "retained_bytes": 4096,
      "peak_rss_bytes": 10162176
    },
    {
      "implementation": "native",
      "workload": "write-full-baseline-v1",
      "payload_bytes": 4096,
      "concurrency": 1,
      "operations": 128,
      "elapsed_seconds": 0.562692,
      "operations_per_second": 227.478,
      "latency_p50_microseconds": 4176.86,
      "latency_p95_microseconds": 8116.31,
      "latency_p99_microseconds": 11092.3,
      "cpu_user_seconds": 0.00995,
      "cpu_system_seconds": 0.003184,
      "allocation_metric": {
        "name": "probe_payload_buffer_allocations",
        "value": 1
      },
      "retained_bytes": 4096,
      "peak_rss_bytes": 22999040
    }
  ]
}
